{
  "schema": "signalbox.handoff/v1",
  "handoff_id": "handoff/sample-source-review",
  "scope_ref": "sample-main-network",
  "synthetic": true,
  "evidence": [
    {
      "id": "evidence/source-contract",
      "scope_ref": "sample-main-network",
      "stage": "source",
      "artifact_ref": "contracts/traffic-policy.json",
      "observed_at": "2026-10-03T00:00:00Z",
      "outcome": "pass"
    }
  ],
  "claims": [
    {
      "schema": "signalbox.claim-record/v1",
      "claim_id": "claim/source-contract",
      "scope_ref": "sample-main-network",
      "stage": "source",
      "outcome": "pass",
      "evidence_refs": [
        "evidence/source-contract"
      ],
      "observed_at": "2026-10-03T00:00:01Z"
    }
  ],
  "acceptance_records": [
    {
      "schema": "signalbox.acceptance-record/v2",
      "record_id": "acceptance/sample-source-review",
      "actor_class": "agent",
      "actor_ref": "actor/sample-reviewer",
      "decision": "accepted",
      "scope_ref": "sample-main-network",
      "claim_refs": [
        "claim/source-contract"
      ],
      "evidence_refs": [
        "evidence/source-contract"
      ],
      "decided_at": "2026-10-03T00:00:02Z"
    }
  ]
}
